{
  "checks": {
    "agent_never_receives_private_scenario": true,
    "all_worker_outputs_are_synthetic": true,
    "ambiguous_non_target_write_stops_with_checkpoint": true,
    "attempt_artifacts_written_atomically": true,
    "duplicate_state_change_blocked_before_second_native_execution": true,
    "idempotent_target_suppressed": true,
    "invalid_json_preserved_without_retry": true,
    "non_idempotent_native_result_hidden": true,
    "non_idempotent_target_executed_once": true,
    "pre_action_uses_actual_environment_checkpoint": true,
    "synthetic_worker_stderr_empty": true,
    "three_effect_class_stage_passed": true,
    "user_never_receives_domain_policy": true,
    "worker_error_preserved": true,
    "worker_messages_exclude_evaluator_pair_ids": true
  },
  "deliberate_failures": {
    "ambiguous_non_target_write": {
      "attempt_ordinal": 6,
      "environment_checkpoint": {
        "agent_data": {
          "sent": [],
          "value": 7
        }
      },
      "evaluator_pair_id": "synthetic-evaluator-6",
      "phase": "post_failure",
      "public_state": {
        "agent_usage": {
          "completion_tokens": 5,
          "prompt_tokens": 7,
          "requests": 1
        },
        "checkpoint_sha256": "5c77782cfa1ba16ab08e8b95b1ebedc3c725842d39fc2267c0708015a3f9d5f7",
        "failure_reason": "ambiguous_non_target_tool_outcome",
        "ledger": [
          {
            "arguments": {
              "value": 7
            },
            "call_id": "call-1",
            "effect_class": "idempotent_state_setting",
            "executed": true,
            "outcome": "unknown",
            "signature": "431e9aa5a43e7ed5bad4e47ba0a331e2d6f1aee0059138437817586405e2e8b1",
            "tool_name": "set_value"
          }
        ],
        "native_tool_execution_count": 1,
        "next_actor": "terminal",
        "public_history": [
          {
            "content": "synthetic request 6",
            "role": "user"
          },
          {
            "role": "assistant",
            "tool_calls": [
              {
                "arguments": {
                  "value": 7
                },
                "id": "call-1",
                "name": "set_value"
              }
            ]
          },
          {
            "content": {
              "code": "result_unknown",
              "outcome": "unknown",
              "retry_safe": false,
              "verification_required": true
            },
            "error": true,
            "role": "tool",
            "tool_call_id": "call-1"
          }
        ],
        "status": "capture_failure",
        "steps": 3,
        "target_native_execution_count": 0,
        "tool_errors": 1,
        "user_usage": {
          "completion_tokens": 5,
          "prompt_tokens": 7,
          "requests": 1
        }
      },
      "runtime_errors": [],
      "synthetic_non_model_output": true,
      "target_effect_class": "non_idempotent_side_effect",
      "target_tool_name": "send_value",
      "worker_records": [
        {
          "participant": "user",
          "raw_text": "{\"kind\":\"message\",\"content\":\"synthetic request 6\"}",
          "request_id": "attempt-06:user:0001",
          "request_sha256": "91a707500938eb0ca561a9ea601642244eaad91eadeb48b817b1100d5d7c2c4c",
          "synthetic_non_model_output": true,
          "usage": {
            "completion_token_count": 5,
            "prompt_token_count": 7
          }
        },
        {
          "participant": "agent",
          "raw_text": "{\"kind\":\"tool\",\"tool_name\":\"set_value\",\"arguments\":{\"value\":7}}",
          "request_id": "attempt-06:agent:0001",
          "request_sha256": "6b3b474558a291281213e0c0aef9e2e8376d70a0023d0079c03246fcd2fb27d9",
          "synthetic_non_model_output": true,
          "usage": {
            "completion_token_count": 5,
            "prompt_token_count": 7
          }
        }
      ]
    },
    "duplicate_state_change": {
      "attempt_ordinal": 7,
      "environment_checkpoint": null,
      "evaluator_pair_id": "synthetic-evaluator-7",
      "phase": "post_failure",
      "public_state": {
        "agent_usage": {
          "completion_tokens": 10,
          "prompt_tokens": 14,
          "requests": 2
        },
        "checkpoint_sha256": null,
        "failure_reason": "duplicate_unsafe_action_proposal",
        "ledger": [
          {
            "arguments": {
              "value": 7
            },
            "call_id": "call-1",
            "effect_class": "idempotent_state_setting",
            "executed": true,
            "outcome": "succeeded",
            "signature": "431e9aa5a43e7ed5bad4e47ba0a331e2d6f1aee0059138437817586405e2e8b1",
            "tool_name": "set_value"
          }
        ],
        "native_tool_execution_count": 1,
        "next_actor": "terminal",
        "public_history": [
          {
            "content": "synthetic request 7",
            "role": "user"
          },
          {
            "role": "assistant",
            "tool_calls": [
              {
                "arguments": {
                  "value": 7
                },
                "id": "call-1",
                "name": "set_value"
              }
            ]
          },
          {
            "content": {
              "value": 7
            },
            "error": false,
            "outcome": "succeeded",
            "role": "tool",
            "tool_call_id": "call-1"
          }
        ],
        "status": "safety_failure",
        "steps": 4,
        "target_native_execution_count": 0,
        "tool_errors": 0,
        "user_usage": {
          "completion_tokens": 5,
          "prompt_tokens": 7,
          "requests": 1
        }
      },
      "runtime_errors": [],
      "synthetic_non_model_output": true,
      "target_effect_class": "non_idempotent_side_effect",
      "target_tool_name": "send_value",
      "worker_records": [
        {
          "participant": "user",
          "raw_text": "{\"kind\":\"message\",\"content\":\"synthetic request 7\"}",
          "request_id": "attempt-07:user:0001",
          "request_sha256": "477b63fc37d992a5eb332be19ea9d4783b7e1a908b6ef20998e7076a59fba902",
          "synthetic_non_model_output": true,
          "usage": {
            "completion_token_count": 5,
            "prompt_token_count": 7
          }
        },
        {
          "participant": "agent",
          "raw_text": "{\"kind\":\"tool\",\"tool_name\":\"set_value\",\"arguments\":{\"value\":7}}",
          "request_id": "attempt-07:agent:0001",
          "request_sha256": "cd05cc329078fb212b7448151dd04deb4b0e8db831aeeb553600bfac7fc0b4b2",
          "synthetic_non_model_output": true,
          "usage": {
            "completion_token_count": 5,
            "prompt_token_count": 7
          }
        },
        {
          "participant": "agent",
          "raw_text": "{\"kind\":\"tool\",\"tool_name\":\"set_value\",\"arguments\":{\"value\":7}}",
          "request_id": "attempt-07:agent:0002",
          "request_sha256": "1c5561a1939de59f636f56dbe9ef9d303a5cba8b53c143b3494f377e19afdb5d",
          "synthetic_non_model_output": true,
          "usage": {
            "completion_token_count": 5,
            "prompt_token_count": 7
          }
        }
      ]
    },
    "invalid_output": {
      "attempt_ordinal": 4,
      "environment_checkpoint": null,
      "evaluator_pair_id": "synthetic-evaluator-4",
      "phase": "post_failure",
      "public_state": {
        "agent_usage": {
          "completion_tokens": 0,
          "prompt_tokens": 0,
          "requests": 0
        },
        "checkpoint_sha256": null,
        "failure_reason": "invalid_agent_output",
        "ledger": [],
        "native_tool_execution_count": 0,
        "next_actor": "terminal",
        "public_history": [
          {
            "content": "synthetic request 4",
            "role": "user"
          }
        ],
        "status": "capture_failure",
        "steps": 2,
        "target_native_execution_count": 0,
        "tool_errors": 0,
        "user_usage": {
          "completion_tokens": 5,
          "prompt_tokens": 7,
          "requests": 1
        }
      },
      "runtime_errors": [],
      "synthetic_non_model_output": true,
      "target_effect_class": "idempotent_state_setting",
      "target_tool_name": "set_value",
      "worker_records": [
        {
          "participant": "user",
          "raw_text": "{\"kind\":\"message\",\"content\":\"synthetic request 4\"}",
          "request_id": "attempt-04:user:0001",
          "request_sha256": "22455dbf30f3a442f7b60f8fc186e8cfc22d201d13b049b08b0c118c4f565302",
          "synthetic_non_model_output": true,
          "usage": {
            "completion_token_count": 5,
            "prompt_token_count": 7
          }
        },
        {
          "parse_error": "ValueError: participant output must be one strict JSON object",
          "participant": "agent",
          "raw_text": "not-json",
          "request_id": "attempt-04:agent:0001",
          "request_sha256": "94aa3a4f97fbf0dd03b61755c4fd680b69d56b396f050595d9a1cd4f2aaa0e65",
          "synthetic_non_model_output": true,
          "usage": {
            "completion_token_count": 5,
            "prompt_token_count": 7
          }
        }
      ]
    },
    "worker_error": {
      "attempt_ordinal": 5,
      "environment_checkpoint": null,
      "evaluator_pair_id": "synthetic-evaluator-5",
      "phase": "pre_action",
      "public_state": {
        "agent_usage": {
          "completion_tokens": 0,
          "prompt_tokens": 0,
          "requests": 0
        },
        "checkpoint_sha256": null,
        "failure_reason": "user_worker_error",
        "ledger": [],
        "native_tool_execution_count": 0,
        "next_actor": "terminal",
        "public_history": [],
        "status": "infrastructure_failure",
        "steps": 1,
        "target_native_execution_count": 0,
        "tool_errors": 0,